{
  "schema_version": "0.1.0",
  "job_id": "job-todo-lite-no-home-no-detail-sample-001",
  "prd_id": "prd-todo-lite-no-home-no-detail-sample-001",
  "template_id": "flutter-open-lite",
  "domain_name": "待办事项 App（无首页无详情）",
  "complexity_level": "L1-field-profile",
  "capability_flags": [
    "navigation",
    "local-storage",
    "theme",
    "list",
    "form",
    "create-record",
    "edit-record",
    "field-validation",
    "status-field"
  ],
  "entities": [
    {
      "entity_id": "entity-todo-item",
      "name": "待办事项",
      "fields": [
        {
          "name": "task_id",
          "type": "string",
          "required": true,
          "description": "待办唯一标识"
        },
        {
          "name": "title",
          "type": "string",
          "required": true,
          "description": "待办标题"
        },
        {
          "name": "category",
          "type": "string",
          "required": true,
          "description": "待办分类"
        },
        {
          "name": "status",
          "type": "enum[inbox,inProgress,done]",
          "required": true,
          "description": "待办状态"
        },
        {
          "name": "note",
          "type": "string",
          "required": false,
          "description": "补充备注"
        }
      ],
      "source": "local_storage"
    }
  ],
  "domain_copy": {
    "title": "待办事项 App（无首页无详情）",
    "summary": "把待办事项需求整理成基于通用中性交互承载 Flutter 模板的 Android MVP 规格，并保留待办状态分布与任务字段语义。",
    "problem_statement": "generic compile 在映射到 open-lite 骨架前，不能把待办的状态分布、标题、分类和备注等语义压平成无差别 record。"
  },
  "critical_flows": [
    "创建待办"
  ],
  "behavior_rules": [
    {
      "rule_id": "behavior-browse-records",
      "kind": "browse",
      "description": "集合浏览承载单元必须展示完整待办、支持按状态筛选，并允许进入结果检查入口。",
      "capability_refs": [
        "list"
      ],
      "surface_refs": [
        "surface-collection"
      ],
      "entity_refs": [
        "entity-todo-item"
      ],
      "field_refs": [
        "task_id",
        "title",
        "category",
        "status",
        "note"
      ],
      "acceptance_refs": [
        "ac-list"
      ],
      "required": true
    },
    {
      "rule_id": "behavior-create-record",
      "kind": "create",
      "description": "用户可以通过实体变更承载单元创建或编辑一条待办并立即看到结果。",
      "capability_refs": [
        "form",
        "create-record",
        "field-validation",
        "local-storage"
      ],
      "surface_refs": [
        "surface-mutation"
      ],
      "entity_refs": [
        "entity-todo-item"
      ],
      "field_refs": [
        "title",
        "category",
        "status",
        "note"
      ],
      "acceptance_refs": [
        "ac-form",
        "ac-persistence"
      ],
      "required": true
    },
    {
      "rule_id": "behavior-update-record",
      "kind": "update",
      "description": "用户可以从结果检查入口进入实体变更承载单元，更新标题、分类、状态和备注。",
      "capability_refs": [
        "form",
        "edit-record",
        "field-validation",
        "local-storage"
      ],
      "surface_refs": [
        "surface-mutation"
      ],
      "entity_refs": [
        "entity-todo-item"
      ],
      "field_refs": [
        "title",
        "category",
        "status",
        "note"
      ],
      "acceptance_refs": [
        "ac-form"
      ],
      "required": true
    },
    {
      "rule_id": "behavior-persist-records",
      "kind": "persist",
      "description": "领域记录必须通过本地仓储持久化并可在应用重启后恢复。",
      "capability_refs": [
        "local-storage"
      ],
      "surface_refs": [
        "surface-collection",
        "surface-mutation"
      ],
      "entity_refs": [
        "entity-todo-item"
      ],
      "acceptance_refs": [
        "ac-persistence"
      ],
      "required": true
    },
    {
      "rule_id": "behavior-navigate-surfaces",
      "kind": "navigate",
      "description": "当前需求声明的集合浏览和实体变更承载单元之间路径明确且可达。",
      "capability_refs": [
        "navigation"
      ],
      "surface_refs": [
        "surface-collection",
        "surface-mutation"
      ],
      "entity_refs": [
        "entity-todo-item"
      ],
      "acceptance_refs": [
        "ac-navigation"
      ],
      "required": true
    }
  ],
  "persistence_contract": {
    "mode": "local-hive",
    "repository_path": "lib/repositories/record_repository.dart",
    "entity_refs": [
      "entity-todo-item"
    ],
    "capability_refs": [
      "local-storage"
    ],
    "required": true
  },
  "semantic_acceptance_rules": [
    {
      "rule_id": "ac-list",
      "label": "待办集合浏览承载单元可浏览",
      "description": "集合浏览承载单元必须展示完整待办、支持按状态筛选，并允许进入结果检查入口。",
      "field_refs": [
        "task_id",
        "title",
        "category",
        "status",
        "note"
      ],
      "evidence_pattern": "待办事项 App（无首页无详情）|task_id|taskId|title|category|status|note"
    },
    {
      "rule_id": "ac-form",
      "label": "待办变更承载单元链路完整",
      "description": "用户可以通过实体变更承载单元创建或编辑一条待办并立即看到结果。",
      "field_refs": [
        "task_id",
        "title",
        "category",
        "status",
        "note"
      ],
      "evidence_pattern": "待办事项 App（无首页无详情）|task_id|taskId|title|category|status|note"
    },
    {
      "rule_id": "ac-persistence",
      "label": "本地持久化可恢复",
      "description": "应用重启后仍能读取本地记录数据。",
      "field_refs": [
        "task_id",
        "title",
        "category",
        "status",
        "note"
      ],
      "evidence_pattern": "待办事项 App（无首页无详情）|task_id|taskId|title|category|status|note"
    },
    {
      "rule_id": "ac-navigation",
      "label": "核心承载单元可导航",
      "description": "当前需求声明的集合浏览和实体变更承载单元之间路径明确且可达。",
      "evidence_pattern": "待办事项 App（无首页无详情）"
    }
  ]
}
